{
  "$schema": "https://json-schema.org/draft/2020-12/schema",
  "$id": "urn:pxapi:schema:client-report-model:1.0.0",
  "title": "PXAPI client report model v1",
  "description": "The customer projection of one Analysis Run (Confluence 39846055 §12): the business-language content from which the customer report is rendered, and nothing else. Its property list is the leakage boundary: no member of this document, at any depth, carries internal analysis vocabulary, and no reason code, confidence, coverage figure or method detail reaches the customer. Every lever traces back to at least one product-diagnosis recommendation. A presented index is either SHOWN with a number or WITHHELD with no number and no reason text; a withheld index is never a finding about the website. At least one lever and at least one closing action are always present; an empty scores or charts array means nothing of that kind is presented, never that anything was assessed or not assessed.",
  "type": "object",
  "properties": {
    "schema_version": {
      "$ref": "urn:pxapi:schema:common:1.0.0#/$defs/schema_version",
      "description": "Required. Always 1.0.0 for this contract."
    },
    "run_id": {
      "$ref": "urn:pxapi:schema:common:1.0.0#/$defs/id",
      "description": "Required. The Analysis Run this customer projection belongs to."
    },
    "generated_at": {
      "$ref": "urn:pxapi:schema:common:1.0.0#/$defs/timestamp",
      "description": "Required. When the customer projection was generated."
    },
    "projection_version": {
      "$ref": "urn:pxapi:schema:common:1.0.0#/$defs/short_text",
      "description": "Required. The version of the projection rules that produced this content, so that reports from different runs are comparable only when the projection is the same."
    },
    "language": {
      "$ref": "urn:pxapi:schema:common:1.0.0#/$defs/language",
      "description": "Required. The language of every text in this document as a two-letter ISO 639-1 code; the rendered report uses the same language."
    },
    "company_name": {
      "anyOf": [
        { "$ref": "urn:pxapi:schema:common:1.0.0#/$defs/short_text" },
        { "type": "null" }
      ],
      "description": "Required, nullable. The name of the business as it appears in the report; null if and only if the business is not named in the report."
    },
    "headline": {
      "$ref": "urn:pxapi:schema:common:1.0.0#/$defs/short_text",
      "description": "Required. The single-line headline of the report, in business language."
    },
    "summary": {
      "$ref": "urn:pxapi:schema:common:1.0.0#/$defs/text",
      "description": "Required. The summary of the report for the entrepreneur, in business language."
    },
    "levers": {
      "type": "array",
      "items": { "$ref": "#/$defs/lever" },
      "minItems": 1,
      "description": "Required. The business levers presented to the customer, in presentation order. At least one is required: a report without a lever is invalid, so an empty array is rejected."
    },
    "scores": {
      "type": "array",
      "items": { "$ref": "#/$defs/shown_score" },
      "description": "Required. The indices presented to the customer, in presentation order. An empty array means no index is presented; it never means anything was withheld — that is stated per index."
    },
    "charts": {
      "type": "array",
      "items": { "$ref": "#/$defs/chart" },
      "description": "Required. The charts the rendered report embeds, in presentation order. An empty array means the report has no chart."
    },
    "closing_actions": {
      "type": "array",
      "items": { "$ref": "urn:pxapi:schema:common:1.0.0#/$defs/text" },
      "minItems": 1,
      "description": "Required. The closing calls to action for the entrepreneur, in presentation order. At least one is required: a report without a closing action is invalid, so an empty array is rejected."
    }
  },
  "required": [
    "schema_version",
    "run_id",
    "generated_at",
    "projection_version",
    "language",
    "company_name",
    "headline",
    "summary",
    "levers",
    "scores",
    "charts",
    "closing_actions"
  ],
  "additionalProperties": false,
  "$defs": {
    "lever": {
      "type": "object",
      "properties": {
        "lever_id": {
          "$ref": "urn:pxapi:schema:common:1.0.0#/$defs/id",
          "description": "Required. The stable identity of this lever within the report."
        },
        "title": {
          "$ref": "urn:pxapi:schema:common:1.0.0#/$defs/short_text",
          "description": "Required. A single-line title of the lever, in business language."
        },
        "business_impact": {
          "$ref": "urn:pxapi:schema:common:1.0.0#/$defs/text",
          "description": "Required. What the lever means for the business, in business language."
        },
        "next_steps": {
          "type": "array",
          "items": { "$ref": "urn:pxapi:schema:common:1.0.0#/$defs/text" },
          "minItems": 1,
          "description": "Required. The concrete next steps for this lever, in order. At least one is required: a lever without a next step is invalid, so an empty array is rejected."
        },
        "recommendation_refs": {
          "type": "array",
          "items": { "$ref": "urn:pxapi:schema:common:1.0.0#/$defs/id" },
          "minItems": 1,
          "uniqueItems": true,
          "description": "Required. The recommendation_ids of the product-diagnosis recommendations this lever presents. At least one is required: a lever without a recommendation behind it is invalid, so an empty array is rejected."
        }
      },
      "required": ["lever_id", "title", "business_impact", "next_steps", "recommendation_refs"],
      "additionalProperties": false
    },
    "shown_score": {
      "type": "object",
      "properties": {
        "index_id": {
          "$ref": "urn:pxapi:schema:common:1.0.0#/$defs/id",
          "description": "Required. The index_id of the scorecard index this entry presents."
        },
        "label": {
          "$ref": "urn:pxapi:schema:common:1.0.0#/$defs/short_text",
          "description": "Required. The customer-facing label of the index, in business language."
        },
        "state": {
          "type": "string",
          "enum": ["SHOWN", "WITHHELD"],
          "description": "Required. Whether a number is presented for this index. SHOWN: the value is presented. WITHHELD: the index is presented without a number and without any reason text; a withheld index is never a finding about the website. No partial or placeholder state exists."
        },
        "value": {
          "anyOf": [
            { "$ref": "urn:pxapi:schema:common:1.0.0#/$defs/score_value" },
            { "type": "null" }
          ],
          "description": "Required, nullable. The presented value on the 0..100 scale; non-null if and only if state is SHOWN, null if and only if state is WITHHELD. A withheld index carries no number and no reason."
        }
      },
      "required": ["index_id", "label", "state", "value"],
      "additionalProperties": false,
      "allOf": [
        {
          "if": {
            "properties": { "state": { "const": "SHOWN" } },
            "required": ["state"]
          },
          "then": {
            "properties": {
              "value": { "type": "number" }
            }
          },
          "else": {
            "properties": {
              "value": { "type": "null" }
            }
          }
        }
      ]
    },
    "chart": {
      "type": "object",
      "properties": {
        "chart_id": {
          "$ref": "urn:pxapi:schema:common:1.0.0#/$defs/id",
          "description": "Required. The stable identity of this chart within the report."
        },
        "kind": {
          "$ref": "urn:pxapi:schema:common:1.0.0#/$defs/token",
          "description": "Required. The kind of chart (e.g. index_bars, radar, gauge) as an opaque token whose meaning the renderer defines."
        },
        "data_ref": {
          "$ref": "urn:pxapi:schema:common:1.0.0#/$defs/artifact_ref",
          "description": "Required. The chart data artifact the renderer draws this chart from."
        }
      },
      "required": ["chart_id", "kind", "data_ref"],
      "additionalProperties": false
    }
  }
}
